{
  "$schema": "https://json-schema.org/draft/2020-12/schema",
  "$id": "https://github.com/MesmerPrism/rusty-morphospace-work-environment/schemas/planned-publication-accounting-receipt.schema.json",
  "title": "Planned publication accounting receipt",
  "description": "Complete commit and lifecycle accounting for one externally executed prepared publication. Validation records workflow state only and performs no Git, device, or acceptance mutation.",
  "type": "object",
  "additionalProperties": false,
  "required": ["schema","accounting_id","project_id","bundle_id","trigger_unit_id","prepared_plan","prepared_event","executed_push_receipt","chronology","dependency_order","execution_order","repositories","workspace_transition","force_push_used","remote_readback_complete","failure"],
  "properties": {
    "$schema": { "type": "string" },
    "schema": { "const": "rusty.morphospace.workflow.planned_publication_accounting.v1" },
    "accounting_id": { "$ref": "#/$defs/id" },
    "project_id": { "$ref": "#/$defs/id" },
    "bundle_id": { "$ref": "#/$defs/id" },
    "trigger_unit_id": { "$ref": "#/$defs/id" },
    "accepted_unit_attribution": { "type":"object","additionalProperties":false,"required":["mode","trigger_unit_id","unit_ids"],"properties":{"mode":{"const":"exact-prepared-range-partition"},"trigger_unit_id":{"$ref":"#/$defs/id"},"unit_ids":{"type":"array","minItems":2,"uniqueItems":true,"items":{"$ref":"#/$defs/id"}}} },
    "prepared_plan": { "oneOf": [
      { "$ref": "#/$defs/file" },
      { "type":"object","additionalProperties":false,"required":["container","member"],"properties":{"container":{"$ref":"#/$defs/file"},"member":{"const":"push_plan"}} }
    ] },
    "prepared_event": { "oneOf": [
      { "type":"object","additionalProperties":false,"required":["event_id","path","sha256"],"properties":{"event_id":{"$ref":"#/$defs/id"},"path":{"$ref":"#/$defs/path"},"sha256":{"$ref":"#/$defs/hash"}} },
      { "type":"object","additionalProperties":false,"required":["transaction_id","event_id","intent","completion"],"properties":{"transaction_id":{"$ref":"#/$defs/id"},"event_id":{"$ref":"#/$defs/id"},"intent":{"$ref":"#/$defs/file"},"completion":{"$ref":"#/$defs/file"}} }
    ] },
    "executed_push_receipt": { "$ref": "#/$defs/file" },
    "chronology": { "type":"object","additionalProperties":false,"required":["prepared_at","push_started_at","push_finished_at","accounted_at"],"properties":{"prepared_at":{"$ref":"#/$defs/time"},"push_started_at":{"$ref":"#/$defs/time"},"push_finished_at":{"$ref":"#/$defs/time"},"accounted_at":{"$ref":"#/$defs/time"}} },
    "dependency_order": { "$ref":"#/$defs/id-list" },
    "execution_order": { "$ref":"#/$defs/id-list" },
    "repositories": { "type":"array","minItems":1,"items":{"$ref":"#/$defs/repository"} },
    "workspace_transition": { "type":"object","additionalProperties":false,"required":["pending_push_bundle_before","pending_push_bundle_after"],"properties":{"pending_push_bundle_before":{"$ref":"#/$defs/id"},"pending_push_bundle_after":{"type":"null"}} },
    "force_push_used": { "const": false },
    "remote_readback_complete": { "const": true },
    "failure": { "type":"null" }
  },
  "$defs": {
    "id": { "type":"string","pattern":"^[a-z0-9][a-z0-9-]{1,127}$" },
    "hash": { "type":"string","pattern":"^[0-9a-f]{64}$" },
    "revision": { "type":"string","pattern":"^[0-9a-f]{40}$" },
    "tree": { "type":"string","pattern":"^[0-9a-f]{40}$" },
    "time": { "type":"string","format":"date-time" },
    "path": { "type":"string","pattern":"^(?![A-Za-z]:|/|.*(?:^|/)\\.\\.(?:/|$))[A-Za-z0-9._/-]+$" },
    "file": { "type":"object","additionalProperties":false,"required":["path","sha256"],"properties":{"path":{"$ref":"#/$defs/path"},"sha256":{"$ref":"#/$defs/hash"}} },
    "synchronized-carried-acceptance": { "type":"object","additionalProperties":false,"required":["prior_accounting","carried_revision","prior_status_evidence","current_acceptance_evidence"],"properties":{"prior_accounting":{"$ref":"#/$defs/file"},"carried_revision":{"$ref":"#/$defs/revision"},"prior_status_evidence":{"$ref":"#/$defs/file"},"current_acceptance_evidence":{"$ref":"#/$defs/file"}} },
    "synchronized-readback": { "type":"object","additionalProperties":false,"required":["executed_action","unchanged_revision","no_mutation_inferred"],"properties":{"executed_action":{"const":"readback-only"},"unchanged_revision":{"$ref":"#/$defs/revision"},"no_mutation_inferred":{"const":true}} },
    "id-list": { "type":"array","minItems":1,"uniqueItems":true,"items":{"$ref":"#/$defs/id"} },
    "unit": { "type":"object","additionalProperties":false,"required":["unit_id","role","status_at_publication","status_evidence","no_acceptance_claim"],"properties":{"unit_id":{"$ref":"#/$defs/id"},"role":{"enum":["triggering-unit","carried-unit","intervening-unit","bundle-accepted-unit"]},"status_at_publication":{"enum":["accepted","blocked"]},"status_evidence":{"$ref":"#/$defs/file"},"validation_evidence":{"$ref":"#/$defs/file"},"no_acceptance_claim":{"type":"boolean"}},"allOf":[{"if":{"properties":{"role":{"enum":["intervening-unit","bundle-accepted-unit"]}}},"then":{"properties":{"status_at_publication":{"const":"accepted"},"no_acceptance_claim":{"const":false}}}},{"if":{"properties":{"role":{"const":"intervening-unit"}}},"then":{"required":["validation_evidence"]}}] },
    "integration-merge": {
      "type":"object",
      "additionalProperties":false,
      "required":["topology","ordered_parents","merge_base","trees","projections"],
      "properties":{
        "topology":{"const":"two-parent-side-over-protected"},
        "ordered_parents":{"type":"array","minItems":2,"maxItems":2,"uniqueItems":true,"items":{"$ref":"#/$defs/revision"}},
        "merge_base":{"$ref":"#/$defs/revision"},
        "trees":{
          "type":"object",
          "additionalProperties":false,
          "required":["merge_base","side_parent","protected_parent","final"],
          "properties":{
            "merge_base":{"$ref":"#/$defs/tree"},
            "side_parent":{"$ref":"#/$defs/tree"},
            "protected_parent":{"$ref":"#/$defs/tree"},
            "final":{"$ref":"#/$defs/tree"}
          }
        },
        "projections":{
          "type":"object",
          "additionalProperties":false,
          "required":["merge_base_to_side","merge_base_to_protected","protected_to_final","side_to_final"],
          "properties":{
            "merge_base_to_side":{"type":"array","minItems":1,"uniqueItems":true,"items":{"$ref":"#/$defs/path"}},
            "merge_base_to_protected":{"type":"array","minItems":1,"uniqueItems":true,"items":{"$ref":"#/$defs/path"}},
            "protected_to_final":{"type":"array","minItems":1,"uniqueItems":true,"items":{"$ref":"#/$defs/path"}},
            "side_to_final":{"type":"array","minItems":1,"uniqueItems":true,"items":{"$ref":"#/$defs/path"}}
          }
        }
      }
    },
    "commit": {
      "type":"object",
      "additionalProperties":false,
      "required":["revision","role","unit_id","changed_paths"],
      "properties":{
        "revision":{"$ref":"#/$defs/revision"},
        "role":{"enum":["triggering-unit","carried-unit","intervening-unit","bundle-accepted-unit","workflow-publication-finalization","intervening-planning-evidence","verified-integration-merge"]},
        "unit_id":{"oneOf":[{"$ref":"#/$defs/id"},{"type":"null"}]},
        "evidence_kind":{"enum":["blocker","publication-finalization"]},
        "changed_paths":{"type":"array","uniqueItems":true,"items":{"$ref":"#/$defs/path"}},
        "integration_merge":{"$ref":"#/$defs/integration-merge"}
      },
      "allOf":[
        {"if":{"properties":{"role":{"const":"intervening-planning-evidence"}}},"then":{"required":["evidence_kind"],"properties":{"unit_id":{"type":"null"}}},"else":{"not":{"required":["evidence_kind"]}}},
        {"if":{"properties":{"role":{"const":"verified-integration-merge"}}},"then":{"required":["integration_merge"],"properties":{"unit_id":{"type":"null"},"changed_paths":{"maxItems":0}}},"else":{"properties":{"changed_paths":{"minItems":1}},"not":{"required":["integration_merge"]}}}
      ]
    },
    "intervening-accepted-publication": { "type":"object","additionalProperties":false,"required":["executed_final_revision","executed_remote_readback_revision","current_final_revision","current_remote_readback_revision","original_to_current_fast_forward","recovered_at","allowed_planning_evidence_paths"],"properties":{"executed_final_revision":{"$ref":"#/$defs/revision"},"executed_remote_readback_revision":{"$ref":"#/$defs/revision"},"current_final_revision":{"$ref":"#/$defs/revision"},"current_remote_readback_revision":{"$ref":"#/$defs/revision"},"original_to_current_fast_forward":{"const":true},"recovered_at":{"$ref":"#/$defs/time"},"allowed_planning_evidence_paths":{"type":"array","uniqueItems":true,"items":{"$ref":"#/$defs/path"}}} },
    "repository": { "type":"object","additionalProperties":false,"required":["repo_id","role","branch","upstream","old_revision","prepared_revision","final_revision","remote_readback_revision","source_first","planning_last","fast_forward_verified","force_push_used","worktree_clean","units","commits","allowed_finalization_paths"],"properties":{"repo_id":{"$ref":"#/$defs/id"},"role":{"enum":["source","planning-transport"]},"branch":{"type":"string","minLength":1},"upstream":{"type":"string","minLength":1},"old_revision":{"$ref":"#/$defs/revision"},"prepared_revision":{"$ref":"#/$defs/revision"},"final_revision":{"$ref":"#/$defs/revision"},"remote_readback_revision":{"$ref":"#/$defs/revision"},"source_first":{"type":"boolean"},"planning_last":{"type":"boolean"},"fast_forward_verified":{"const":true},"force_push_used":{"const":false},"worktree_clean":{"const":true},"units":{"type":"array","items":{"$ref":"#/$defs/unit"}},"commits":{"type":"array","items":{"$ref":"#/$defs/commit"}},"allowed_finalization_paths":{"type":"array","uniqueItems":true,"items":{"$ref":"#/$defs/path"}},"synchronized_carried_acceptance":{"$ref":"#/$defs/synchronized-carried-acceptance"},"synchronized_readback":{"$ref":"#/$defs/synchronized-readback"},"intervening_accepted_publication":{"$ref":"#/$defs/intervening-accepted-publication"}},"oneOf":[{"required":["synchronized_carried_acceptance"],"not":{"required":["synchronized_readback"]},"properties":{"role":{"const":"source"},"commits":{"maxItems":0}}},{"required":["synchronized_readback"],"not":{"required":["synchronized_carried_acceptance"]},"properties":{"role":{"const":"source"}}},{"not":{"anyOf":[{"required":["synchronized_carried_acceptance"]},{"required":["synchronized_readback"]}]},"properties":{"commits":{"minItems":1}}}] }
  }
}
